### ISSUE TITLE
Can not connect the camera.

### ISSUE THREAD

**Issue by zzpbuaa** [Jazea/Onvif.Core#27]
Hi all,

I followed the sample code and tried to connect my IPC but it just hang after call the Create function.
![image](https://github.com/user-attachments/assets/d0a3e1d7-98bb-48da-9726-86d328c845be)

I'm using .Net Framework 4.7. Does anyone have a similar situation?

**Comment by HarryJeacock** [comment]
did you find a solution to this? i have the same when i use break points to traverse the code its failing on Media.GetProfilesAsync().ConfigureAwait(false) for me atleast

**Comment by stoex** [comment]
@zzpbuaa what camera do you use? Can you provide your exception text?

**Comment by zzpbuaa** [comment]
@stoex , it's a TPLINK IP camera. It didn't get an exception, just hang. It didn't go to line 36 or line 40.

**Comment by stoex** [comment]
@zzpbuaa That's strange. How much time did you give the program to execute? Even if errors occur, my program doesn't hang. If there's an exception, you could try logging it to the console like this:

```c#
Camera.Create(account, ex =>
{
    Console.WriteLine(ex.Message);
});
``` 

If that doesn’t help, you might want to investigate the `Create` method or the `Testing` method where the issue could be occurring. 

Maybe it would make sense to use Wireshark to check the messages between your app and the camera.

**Comment by thorschierbeck** [comment]
I have the same issue with .net 8 and wpf. I am using a reolink RLC811A. My code looks like this:
try
{
	var account = new Account("192.168.1.50:8000", "<username>", "<********>");
	var camera = Camera.Create(account, ex =>
	{
		Console.WriteLine(ex.Message);
	});

	if (camera != null)
	{
		//move...
		var vector1 = new PTZVector { PanTilt = new Vector2D { x = 0.5f } };
		var speed1 = new PTZSpeed { PanTilt = new Vector2D { x = 1f, y = 1f } };
		await camera.MoveAsync(MoveType.Absolute, vector1, speed1, 0);

		//zoom...
		var vector2 = new PTZVector { Zoom = new Vector1D { x = 1f } };
		var speed2 = new PTZSpeed { Zoom = new Vector1D { x = 1f } };
		await camera.MoveAsync(MoveType.Absolute, vector2, speed2, 0);

		//focus...
		//var focusMove = new FocusMove { Absolute=new AbsoluteFocus {   } };
		//await camera.FocusAsync(focusMove);
	}
}
catch (FileNotFoundException ex)
{
	Console.WriteLine($"File not found: {ex.Message}");
}
catch (Exception ex)
{
	Console.WriteLine($"An error occurred: {ex.Message}");
}

**Comment by thorschierbeck** [comment]
after some more exploring the problem i used Wireshark and this is my result. The code still never goes any further than trying to creat a camera. And I get this exception in output window in visual studio:
Exception thrown: 'System.IO.FileNotFoundException' in System.Private.CoreLib.dll

this is how it looks in wireshark
5	3.200624	ReolinkInnov_b6:1e:f0	Broadcast	ARP	60	Who has 192.168.1.1? Tell 192.168.1.50
6	3.266302	192.168.1.10	224.0.0.251	MDNS	79	Standard query 0x19ac PTR _arduino._tcp.local, "QM" question
7	3.571435	192.168.1.10	192.168.1.50	TCP	66	62993 → 8000 [SYN] Seq=0 Win=64240 Len=0 MSS=1460 WS=256 SACK_PERM
8	3.572028	192.168.1.50	192.168.1.10	TCP	66	8000 → 62993 [SYN, ACK] Seq=0 Ack=1 Win=64240 Len=0 MSS=1460 SACK_PERM WS=2
9	3.572084	192.168.1.10	192.168.1.50	TCP	54	62993 → 8000 [ACK] Seq=1 Ack=1 Win=1051136 Len=0
10	3.590342	192.168.1.10	192.168.1.50	HTTP/XML	519	POST /onvif/device_service HTTP/1.1 
11	3.590683	192.168.1.50	192.168.1.10	TCP	60	8000 → 62993 [ACK] Seq=1 Ack=466 Win=64076 Len=0
12	3.631471	192.168.1.50	192.168.1.10	TCP	1514	8000 → 62993 [ACK] Seq=1 Ack=466 Win=64076 Len=1460 [TCP PDU reassembled in 14]
13	3.631471	192.168.1.50	192.168.1.10	TCP	1514	8000 → 62993 [ACK] Seq=1461 Ack=466 Win=64076 Len=1460 [TCP PDU reassembled in 14]
14	3.631471	192.168.1.50	192.168.1.10	HTTP/XML	104	HTTP/1.1 200 OK 
15	3.631471	192.168.1.50	192.168.1.10	TCP	60	8000 → 62993 [FIN, ACK] Seq=2971 Ack=466 Win=64076 Len=0
16	3.631684	192.168.1.10	192.168.1.50	TCP	54	62993 → 8000 [ACK] Seq=466 Ack=2972 Win=1051136 Len=0
17	3.645325	192.168.1.10	192.168.1.50	TCP	54	62993 → 8000 [FIN, ACK] Seq=466 Ack=2972 Win=1051136 Len=0
18	3.645699	192.168.1.50	192.168.1.10	TCP	60	8000 → 62993 [ACK] Seq=2972 Ack=467 Win=64076 Len=0
19	4.239946	ReolinkInnov_b6:1e:f0	Broadcast	ARP	60	Who has 192.168.1.1? Tell 192.168.1.50

it looks like the host and camera is communicating at line 6 -> 18

**Comment by stoex** [comment]
@thorschierbeck so you don’t get an exception message on the following line? How long did you wait for the program to execute?

`var camera = Camera.Create(account, ex =>
{
Console.WriteLine(ex.Message);
});`

**Comment by jlovald** [comment]
Is it possible that the IP is incorrect, or the `GetDeviceCapabilities` is only reachable using https? I remember having run into a camera where that is the case. I have had issues were a camera listed imaging capabilities, but did not listen to the XAddr provided in the `GetDeviceCapabilitiesResponse`. The result of that issue was that it timed out after the default binding timeout, which can be significant. The timeout should probably be reduced during pre-authentication, and maybe in general.
